{
  "personalInformation": {
    "summary": "Resourceful Facilities Tech with solid background in preventative maintenance repair. Talented Facilities Tech with more than 3 years of experience developing and executing maintenance programs. Excellent troubleshooting skills. Detail-oriented professional with strong technical skills and the ability to learn concepts quickly.",
    "title": "ENGINEERING AIDE"
  },
  "professionalExperience": [
    {
      "company": "Company Name",
      "position": "Engineering Aide",
      "startDate": "12/2006",
      "endDate": "04/2009",
      "location": "City, State",
      "responsibilities": [
        "Aided other departments in the development of plans and cost estimates on road, parking lot and drainage projects.Computed load and grade requirements and material stress factors to determine design specifications.",
        "Wrote daily detailed reports logging work progress for quality assurance purposes.",
        "Completed all repairs and maintenance work to company standards.",
        "Planned work and determined appropriate tools and equipment.",
        "Took care of facility equipment, grounds, roads and fences."
      ]
    },
    {
      "company": "Company Name",
      "position": "Service Technician",
      "startDate": "08/2004",
      "endDate": "12/2006",
      "location": "City, State",
      "responsibilities": [
        "Followed checklists to verify that all important parts were examined.",
        "Serviced air conditioning, heating, engine- cooling and electrical systems.",
        "Rebuilt faulty assemblies, including steering systems and linkages.",
        "Examined vehicles to determine the extent of damage or malfunctions.",
        "Specialized in servicing brakes and fuel systems.",
        "Communicated with customers regarding vehicle issues and potential repairs.",
        "Repaired and replaced belts, hoses and steering systems.",
        "Executed all phases of power system tear down and repair.",
        "Operated pneumatic tools and air compressors.",
        "Removed and replaced tires, shocks, struts and brakes.",
        "Contributed to repeat and referral business by using strong customer service and problem solving skills.",
        "Repaired and replaced radiators and water pumps.",
        "Organized work records and filed reports.",
        "Transported customers to and from the shop for the customer service program"
      ]
    },
    {
      "company": "Company Name",
      "position": "Concrete Finisher",
      "startDate": "05/1997",
      "endDate": "07/2004",
      "location": "City, State",
      "responsibilities": [
        "Shaped and built roads using large construction equipment.",
        "Operated a bulldozer to properly deploy waste products at compactors.",
        "Documented daily equipment inspections and submitted daily inspection forms to supervisor.",
        "Performed daily maintenance to the machine cab and wheels.",
        "Operated equipment safely and efficiently at all times.",
        "Serviced and maintained vehicles and heavy equipment.",
        "Correctly used aggregate sizes and classifications for all road construction.",
        "Listened to warning alarms and responded accordingly.",
        "Loaded proper materials while abiding by all safety and legal standards.",
        "Obtained proper signatures as required.",
        "Monitored various gauges during vehicle operation and investigated and repaired any abnormalities.",
        "Operated and maintained a forklift truck in a safe and efficient manner.",
        "Retained shop order segregation during yard movement.",
        "Set and read grade stakes to construct roads, parking lots, building pads, landfills and sediment ponds.",
        "Executed daily pre-trip and post-trip inspections and documentation in compliance with DOT guidelines and company policies.",
        "Completed all repairs and maintenance work to company standards.",
        "Counted and verified orders picked to ensure accuracy.",
        "Planned work and determined appropriate tools and equipment."
      ]
    },
    {
      "company": "Company Name",
      "position": "",
      "startDate": "05/1989",
      "endDate": "06/1996",
      "location": "",
      "responsibilities": [
        "Followed checklists to verify that all important parts were examined.",
        "Organized work records and filed reports."
      ]
    }
  ],
  "education": [
    {
      "degree": "Diploma : General Studies",
      "institution": "Maury High School",
      "endDate": "1 1986",
      "location": "State",
      "startDate": ""
    },
    {
      "degree": "General Studies",
      "institution": "Lamar Institute of Technology",
      "location": "City, State",
      "startDate": ""
    },
    {
      "degree": "Industrial Maintenance Industrial Engineering, Production Engineering, Mechanical Engineering and Engineering Welding Fabrication, Industrial and Tool Manufacturing Technology and Process Technology",
      "institution": "Lamar Institute of Technology",
      "gpa": "4.0",
      "location": "City, State",
      "startDate": ""
    }
  ],
  "skills": [
    "customer service",
    "customer service",
    "documentation",
    "forklift",
    "forms",
    "legal",
    "materials",
    "policies",
    "problem solving skills",
    "progress",
    "quality assurance",
    "read",
    "repairs",
    "safety",
    "struts",
    "supervisor",
    "tear"
  ]
}
