{
  "personalInformation": {
    "summary": "SkilledÂ Maintenance MechanicÂ Technician with superb problem solving and multi-tasking skills. Self-directed and motivated worker. To obtain a position where Teamwork, Integrity and Proffesionalism are a high standard in the Company's Mission Statement. All while engaing in new challenges and learning experiences.",
    "title": "EQUIPMENT ENGINEERING TECHNICIAN"
  },
  "professionalExperience": [
    {
      "company": "Company Name",
      "position": "Equipment Engineering Technician",
      "startDate": "05/2014",
      "endDate": "Current",
      "location": "City, State",
      "responsibilities": [
        "Responsibility for designing/selecting robotic systems, run simulation, implementation, commission and programming.",
        "Support and assist maintenance team in troubleshooting difficult breakdowns and chronic equipment failures.",
        "Conduct the installation of factory automation and electrical control systems for manufacturing equipment Provide Troubleshooting of electrical systems in plant manufacturing equipment Provide effective direction, coaching, and OJT to fellow employees on shift to boost their skill sets, and help Production achieve their goals.",
        "Plan and organize between shift and weekend work, including verification, for smooth operations.",
        "Assist the Supervisor in developing PMs and procedures for maintaining all of the equipment in the shop.",
        "Provide shift-to-shift communication in order to keep all associates up to speed and working toward the same goals.",
        "Set an example, and ensure that all associates comply with safety regulations and the plant's safety program",
        "Work with engineers and fellow technicians to resolve technical problems.",
        "Assist in candidate selection as requested.",
        "Maintain departmental records Maintain spare parts inventory.",
        "Identify and order needed parts, maintain tracking system.",
        "Perform other duties as assigned by the Supervisor and Manager."
      ]
    },
    {
      "company": "Company Name",
      "position": "Mechanical Technician",
      "startDate": "04/2013",
      "endDate": "05/2014",
      "location": "City, State",
      "responsibilities": [
        "Implement repair services on all production equipment, auxiliary equipment and building equipment using hand tools, testing tools, manual drawings, computer and any other tools necessary to accomplish the task.",
        "Provide reliable, high quality customer support through on-site inspecting, installing, repairing and/or replacing fire alarm equipment as well as conducting preventive maintenance services pertaining to many different manufacturers equipment.",
        "Ensure conveyor belts working effectively"
      ]
    },
    {
      "company": "Company Name",
      "position": "Operating Engineer / Test Technician",
      "startDate": "11/2007",
      "endDate": "06/2012",
      "location": "City, State",
      "responsibilities": [
        "Operates, repair and maintain Facility/Plant Machinery, Test Equipment, Lubrication and Cooling Systems and High Pressure Systems for NASA unitary Wind Tunnels.",
        "Constructs, modifies, maintains and services wind and propulsion tunnel research facilities used to test models of aircraft components, utilizing knowledge of engineering test methods and procedures.",
        "Installs and aligns mechanical hydraulic and pneumatic test equipment and models on support structures.",
        "Installs instrumentation, thermocouples and pressure taps on model and test equipment.",
        "Inspects test setup and operates equipment to detect and correct malfunctions.",
        "Maintains instrumentation equipment and accessories for pressure valves, icing indicators, drive units, spray units, and pumps.",
        "Confers with engineering and other personnel during testing and modifies model, test support structure, or test equipment as directed.",
        "Inspect, test, and install fire sprinkler systems, standpipe systems, fire pumps, and clean agent systems at various industrial, commercial and institutional facilities in accordance with various codes.",
        "Perform inspections, test and repair/replace fire hoses and fire hydrants.",
        "Generate reports based on inspection findings."
      ]
    },
    {
      "company": "Company Name",
      "position": "Logistics Coordinator / Sr. Lab technician",
      "startDate": "10/2006",
      "endDate": "11/2007",
      "location": "City, State",
      "responsibilities": [
        "Coordinates all incoming and outgoing shipments of solar arrays, panels, shipping containers and ground support equipment."
      ]
    },
    {
      "company": "Company Name",
      "position": "Production Control Analyst",
      "startDate": "11/2004",
      "endDate": "05/2006",
      "location": "City, State",
      "responsibilities": [
        "Expedites materials through production processes, coordinates actions with other departments, verifies kit hardware completeness and configuration, requests drawings and materials to be issued from stores.",
        "Resolves aging work orders, generates Non-conforming Material Reports (NCMR's).",
        "Interfaces with process engineers, manufacturing operators and supervisors to control and analyze the movement of production.",
        "Resolves complex constraints for any WIP that may cause schedule delays, problem solve all audit issue on work centers.",
        "Perform internal and external expediting of critical parts and initiate and process scrap tags, and process miscellaneous issue requests.",
        "Extensive use of the Promis software.",
        "Trains new hires in Class 100 clean room protocol and enforces violations.",
        "Procurement of all clean room articles and consumables with outside vendors.",
        "Supervises courier team of 5 to ensure proper transport of company assets from site to site."
      ]
    },
    {
      "company": "Company Name",
      "position": "Material/Production Planner",
      "startDate": "07/2001",
      "endDate": "02/2004",
      "location": "City, State",
      "responsibilities": [
        "Expedites materials through production processes, coordinates actions with other departments, verifies kit hardware completeness and configuration, requests drawings and materials to be issued from stores.",
        "Resolves aging work orders, generates Non-conforming Material Reports (NCMR's), and generates shipping packing lists and invoice documents.",
        "Responsible for scheduling, releasing, updating, and closing work orders in a timely manner.",
        "Reports oral and written status of work progress to internal customers.",
        "Interfaces with all Operations functions"
      ]
    }
  ],
  "education": [
    {
      "degree": "General Courses",
      "institution": "Monterey Peninsula College",
      "location": "City, State"
    },
    {
      "degree": "Technical Diploma",
      "institution": "San Francisco Police Academy",
      "location": "City, State"
    }
  ],
  "skills": [
    "automation",
    "closing",
    "coaching",
    "oral",
    "hardware",
    "customer support",
    "designing",
    "direction",
    "hand tools",
    "inventory",
    "ISO 9001",
    "Machinery",
    "materials",
    "mechanical",
    "personnel",
    "processes",
    "Procurement",
    "programming",
    "progress",
    "quality",
    "Quality Control",
    "Receiving",
    "repairs",
    "repairing",
    "research",
    "robotic systems",
    "safety",
    "scheduling",
    "shipping",
    "simulation",
    "Supervisor",
    "Test Equipment",
    "Troubleshooting",
    "written",
    "articles"
  ]
}
