{
  "personalInformation": {
    "title": "DIRECTOR OF PR & SOCIAL MEDIA\nExecutive Profile"
  },
  "professionalExperience": [
    {
      "company": "Company Name",
      "position": "Director of PR & Social Media",
      "startDate": "06/2015",
      "endDate": "Current",
      "location": "City, State",
      "responsibilities": [
        "Lead the PR & Social Media Strategy for the relaunch of dELiA*s, successfully repositioning the company as a leading teen brand among its competitors.",
        "Managed critical sponsorship opportunities for dELiA*s with Teen Vogue's Back To School Program, 5 Seconds of Summer Concert Series, BearPaw x dELiA*s free ads on the Geoffrey Tron Screen in Times Square.",
        "Secured extensive Press & Social Media coverage for dELiA*s November Catalog Cover: Teen wonderchef and NY Times Cover Star, Flynn McGarry.",
        "Spearheaded and managed the PR & Social Media Campaigns for Alloy Apparel that took critical market share and social media footprint from Long Tall Sally as a leader in Tall Women's Clothing in 6 months.",
        "Initiated the use of User Generated Content (UGC)on each brand's website and paid ads, resulting in a substantial increase in positive brand sentiment, brand awareness and brand revenue",
        "Increased brand revenue for both companies through social media efforts that amounted revenue 5 times bigger than the initial investment.",
        "Created a brand ambassador program for both companies that included a series of high-profile bloggers, influencers and celebrities at no cost for each brand that served as a continuous form of income and brand awareness",
        "Collaborated with E-Commerce and Marketing to support and drive key promotions organically as well as through paid media campaigns",
        "Provided in-depth data analysis and social media reporting for each brand",
        "Managed budgets and made best use of budgetary funds",
        "Managed an internal team of 3, an external PR agency, an external ad agency, 1 UGC management agency.",
        "Nurtured & cultivated strong relationships with Fashion Directors, key Trade, Ad and Finance publications, Fashion Stylists and Bloggers in the contemporary and teen markets."
      ]
    },
    {
      "company": "Company Name",
      "position": "PR Manager",
      "startDate": "02/2012",
      "endDate": "06/2015",
      "location": "City, State",
      "responsibilities": [
        "Primary Press Liaison for Foley+Corinna, Isabella Fiore, Snob Essentials, Charlotte Ronson, L.A.M.B.and NARR.",
        "Managed a staff of 4 employees for the development and execution of global public relations, event planning, marketing and advertising programs in the US and South Korea.",
        "Secured a continuous stream of high-profile celebrity, blogger, fashion influencer, TV, print and web placements for each brand.",
        "Secured strategic partnerships with the CFDA, Faberge's Big Egg Hunt, Christie's, Studio in A School, Covet Fashion, Refinery29 Shops, Celebrity Exotics, Lucky Shops, SpringNYC at no cost for the company.",
        "Seasonally collaborated with Seventh House PR, Factory PR, HL Group, Autumn Communications, Paul Wilmot Communications during event & fashion show production, West Coast initiatives and celebrity seeding opportunities.",
        "Initiated and lead the Brand Revival initiative for Isabella Fiore."
      ]
    },
    {
      "company": "Company Name",
      "position": "Account Executive",
      "startDate": "07/2011",
      "endDate": "02/2012",
      "location": "City, State",
      "responsibilities": [
        "Managed 8 client accounts (Jewelry, Accessories, Contemporary Clothing, Handbags, Denim)",
        "Secured numerous high-visibility product placements by maintaining close communications with major celebrity representatives/stylists, top editors, bloggers and high-fashion tastemakers.",
        "Brought in 21 new potential client accounts within a 2-month period",
        "Spearheaded and organizing partnerships/collaborations with charity organizations (Project: Camille Zarsky - Charity Water)",
        "Introduced a dynamic collaboration initiative and celebrity endorsements for up-and-coming designers",
        "Supervised social media activity for 3 client accounts",
        "Spearheaded Shine Media's international service outreach in Paris",
        "Produced a tangible increase in brand awareness and customer demand for each client."
      ]
    },
    {
      "company": "Company Name",
      "position": "PR & Marketing Coordinator",
      "startDate": "09/2009",
      "endDate": "02/2010",
      "location": "City, State",
      "responsibilities": [
        "Handled all communications with press, media, stylists and celebrities.",
        "Researched and secured 12 luxury advertising partners.",
        "Covered shows and conducted interviews with designers during New York Fashion Week (September 2009).",
        "Negotiated new high-profile partnership opportunities."
      ]
    },
    {
      "company": "Company Name",
      "position": "Public Relations Executive",
      "startDate": "01/2009",
      "endDate": "07/2011",
      "location": "City, State",
      "responsibilities": [
        "Managed all client accounts (Ready-to-Wear, Accessories, Lifestyle, Hospitality, Education.",
        "Secured the most magazine covers and celebrity placements in the history of the agency (Beyonce, Rihanna, Taylor Swift, Vanessa Hudgens, Kelly Clarkson, Scarlett Johansson, Paris Hilton, etc.)",
        "Wrote, formatted and disseminated key press materials (press and news releases, fact sheets, bios, newsletters).",
        "In charge of the agency's social media pages, website content updates and email newsletter.",
        "Actively seeked & secured new partnership and sponsorship opportunities (Swarovski, CFDA).",
        "Produced annual reports, new client proposals, new marketing and advertising material for the agency and its clients.",
        "Communicated daily with major national & international publications, newspapers, stylists and bloggers regarding sample requests and media placements.",
        "Fostered relationships and networking opportunities with colleagues, clients and media.",
        "Organized and produced Fashion Week presentations, launch events and press previews for a variety of clients.",
        "Managed the US press for the Inaugural Event of the Burj Khalifa Tower in Dubai."
      ]
    },
    {
      "company": "Company Name",
      "position": "Public Relations Associate",
      "startDate": "08/2008",
      "endDate": "10/2008",
      "location": "City, State",
      "responsibilities": [
        "Assisted in all aspects of preparation and production of eight fashion shows during New York Fashion Week (Mara Hoffman, Alexandre Herchcovitch, Buckler, Sabyasatchi, Yigal Azrouel, Araks, Jeremy Scott, House of Holland)",
        "Preparation and execution of high-profile events and after-parties during Fashion Week",
        "Created daily and monthly Press Clips",
        "Updated Press, Trade and Media Contact Lists,",
        "Responsible sample trafficking and sample database."
      ]
    },
    {
      "company": "Company Name",
      "position": "Public Relations & Global Communications Assistant",
      "startDate": "11/2007",
      "endDate": "05/2008",
      "location": "City, State",
      "responsibilities": [
        "Played a key role in the communications for the launch of Vera Wang's new advertising campaign in Greece.",
        "Assisted in the production of Vera Wang's Ready-to-Wear and Lavender Label fashion shows during NY fashion week (February 2008).",
        "Responsible for sample trafficking to publications (sending, monitoring and receiving samples).",
        "Created monthly credit reports."
      ]
    },
    {
      "company": "Company Name",
      "position": "Marketing Intern",
      "startDate": "11/2007",
      "endDate": "04/2007",
      "location": "City, State",
      "responsibilities": [
        "Assisted during company presentations to new clients.",
        "Edited press and marketing materials.",
        "Communicated with high-end accounts and delivered brand assets as needed (Barneys, Selfridges, Harvey Nichols, The Mandarin Oriental).",
        "Handled all sample requests."
      ]
    }
  ],
  "education": [
    {
      "degree": "Master of Science : Marketing",
      "institution": "UNIVERSITY OF BATH",
      "endDate": "9/2006",
      "location": "City, United Kingdom"
    },
    {
      "degree": "Bachelor of Science : International Economic & Political Studies",
      "institution": "UNIVERSITY OF MACEDONIA",
      "endDate": "9/2005",
      "location": "City, Greece",
      "startDate": "9/2005"
    }
  ],
  "skills": [
    "MAC OS",
    "Microsoft Office",
    "Word",
    "Excel",
    "PowerPoint",
    "Outlook",
    "Photoshop",
    "Cision",
    "Fashion GPS",
    "Social Annex"
  ]
}
